{
  "schema_version": "1.0",
  "id": "prior_assisted",
  "primary": false,
  "available_information": ["expression", "groups", "tf_list", "global_regulatory_prior"],
  "excluded_information": ["prior_grn_by_group", "truth_derived_lineage_rates"],
  "planned_variants": [
    {"tool_id": "inferelator3", "execution_mode": "group_native", "variant": "required prior_grn", "role": "assisted", "status": "candidate", "tf_list_handling": "candidate_restriction"},
    {"tool_id": "metasem", "execution_mode": "group_emulated", "variant": "pseudo_grn_mode=provided_prior", "role": "assisted", "status": "candidate", "tf_list_handling": "not_supported"},
    {"tool_id": "scregulate", "execution_mode": "group_native", "variant": "prior_source=provided_prior", "role": "assisted", "status": "candidate", "tf_list_handling": "not_supported"}
  ],
  "notes": [
    "This is an assisted upper bound and is never mixed into the primary ranking or pooled into one cross-tool score.",
    "A simulator-derived global prior may encode truth and must be labelled as information leakage.",
    "scMTNI q>0 is excluded because it combines a group-specific truth prior with truth-derived lineage rates."
  ]
}
