{
  "schema_version": "1.0",
  "id": "order_aware",
  "primary": false,
  "available_information": ["expression", "groups", "tf_list", "lineage_or_group_order"],
  "excluded_information": ["prior_grn", "prior_grn_by_group"],
  "planned_variants": [
    {
      "tool_id": "scmtni",
      "execution_mode": "group_native",
      "variant": "indep=false,q=0 with non-truth lineage rates",
      "role": "secondary",
      "status": "blocked",
      "tf_list_handling": "candidate_restriction"
    },
    {
      "tool_id": "simic",
      "execution_mode": "group_native",
      "variant": "similarity=false",
      "role": "secondary",
      "status": "candidate",
      "tf_list_handling": "candidate_restriction"
    },
    {
      "tool_id": "simic",
      "execution_mode": "group_native",
      "variant": "similarity=true",
      "role": "secondary",
      "status": "candidate",
      "tf_list_handling": "candidate_restriction"
    }
  ],
  "notes": [
    "scMTNI indep=true is not a valid multigroup baseline with the current wrapper.",
    "Simulator lineage_tree gain/loss rates are derived from true group GRNs; native files are leaky and forbidden for an order-only comparison.",
    "scMTNI stays blocked until a justified neutral lineage-rate dataset is derived with a new fingerprint.",
    "Both SimiC variants consume ordered column phenotypes."
  ]
}
